{
  "id": 744,
  "keyword": "energysage",
  "title": "Unlocking the Secrets of Energysage",
  "slug": "energysage",
  "content": "# Unlocking the Secrets of Energysage\n\nIn an increasingly dynamic world, the concept of personal energy has transcended simple physical exertion, evolving into a holistic understanding that encompasses mental clarity, emotional resilience, and overall vitality. This comprehensive approach to managing one's internal resources is what we refer to as **energysage**: the profound wisdom and practical application of principles designed to optimize and sustain an individual's energy levels across all facets of life. It\u2019s about more than just avoiding fatigue; it\u2019s about cultivating a deep, enduring wellspring of vigor that empowers us to engage fully with our daily lives, pursue our aspirations, and maintain a state of optimal well-being.\n\nThis article embarks on a deep dive into the multifaceted world of energysage. We will explore the intricate scientific mechanisms that govern our energy production and utilization, dissect the various factors that influence our vitality, and provide a detailed breakdown of actionable strategies to enhance and preserve this invaluable resource. From the cellular machinery that fuels our every thought and movement to the lifestyle choices that either deplete or replenish our reserves, understanding energysage offers a pathway to a more energized, focused, and fulfilling existence. Prepare to uncover the secrets to unlocking your inherent potential for sustained energy and vitality.\n\n## The Science Behind Energysage\n\nAt its core, energysage is deeply rooted in the biological processes that dictate how our bodies create and utilize energy. The fundamental currency of cellular energy is **adenosine triphosphate (ATP)**, a molecule generated primarily within the mitochondria, often referred to as the \"powerhouses of the cell.\" These tiny organelles convert nutrients\u2014primarily glucose from carbohydrates, but also fatty acids from fats and amino acids from proteins\u2014into ATP through a complex series of biochemical reactions known as cellular respiration. This process involves glycolysis, the Krebs cycle, and oxidative phosphorylation, each step meticulously orchestrated to extract maximum energy from our food.\n\nBeyond this fundamental cellular level, numerous physiological systems play critical roles in regulating our overall energy state. The **endocrine system**, for instance, releases hormones like cortisol, adrenaline, and thyroid hormones, which profoundly influence metabolism, stress response, and baseline energy levels. Imbalances in these hormones can lead to persistent fatigue or excessive stimulation. Similarly, the **nervous system** dictates our alertness, focus, and ability to handle cognitive tasks, drawing heavily on ATP reserves and requiring specific neurotransmitters for optimal function.\n\nThe **digestive system** is pivotal, breaking down food into absorbable nutrients that fuel ATP production. A healthy gut microbiome, for example, can enhance nutrient absorption and even influence mood and energy through the gut-brain axis. Furthermore, the **circulatory system** ensures that oxygen and nutrients are efficiently delivered to cells, and waste products are removed, both essential for continuous energy generation. When any of these systems are compromised\u2014whether by poor nutrition, chronic stress, insufficient sleep, or lack of physical activity\u2014the body's ability to produce and sustain energy is directly impacted. Understanding these intricate biological interconnections provides the scientific foundation for cultivating energysage, allowing us to make informed choices that support our intrinsic energy-generating capabilities.\n\n## Everything You Need to Know\n\nCultivating energysage is a journey of self-awareness and intentional action, focusing on optimizing the various inputs and outputs that govern our vitality. It's about recognizing that energy is not merely a physical state but a holistic reflection of our physical, mental, and emotional well-being.\n\n### Defining Energysage: A Holistic Blueprint\n\nEnergysage represents a comprehensive framework for understanding, managing, and enhancing one's personal energy. It's not a quick fix but a sustainable lifestyle approach that integrates scientific principles with mindful practices. At its heart, energysage encourages individuals to become attuned to their unique energy patterns, identify their personal energy drains and boosters, and implement strategies that foster a state of consistent, high-quality vitality. This involves recognizing the interconnectedness of various bodily systems and external factors, moving beyond a superficial understanding of \"feeling tired\" to a deeper appreciation of the underlying causes and solutions.\n\n### The Pillars of Energysage\n\nAchieving and maintaining optimal energy levels relies on a synergistic approach, built upon several foundational pillars:\n\n#### Nutritional Foundations\n\nThe food we consume is the primary fuel for our bodies. A well-balanced diet provides the necessary macronutrients (carbohydrates, proteins, fats) for energy production and repair, and micronutrients (vitamins, minerals) that act as cofactors in countless biochemical reactions.\n*   **Complex Carbohydrates:** These are slow-releasing energy sources, providing a steady supply of glucose to prevent energy crashes. Examples include whole grains, legumes, and root vegetables.\n*   **Lean Proteins:** Essential for tissue repair and enzyme production, proteins also contribute to satiety and stable blood sugar, preventing energy fluctuations.\n*   **Healthy Fats:** Crucial for hormone production, cell membrane integrity, and as a concentrated energy source. Avocados, nuts, seeds, and olive oil are excellent choices.\n*   **Micronutrients:** Vitamins B-complex are vital for energy metabolism, iron prevents anemia and fatigue, and magnesium plays a role in ATP production. A diverse intake of fruits and vegetables ensures a broad spectrum of these essential elements.\n*   **Hydration:** Water is indispensable for virtually every bodily function, including nutrient transport and waste elimination. Dehydration can significantly impair cognitive function and lead to fatigue.\n\nMany people find that **metabolism-boosting supplements** can be helpful. [Click here](https://0a72eyrjwisxgl36mgow4lrudn.hop.clickbank.net) to learn more about Java Burn, a metabolism-boosting supplement designed to support healthy weight management.\n\n#### The Role of Movement\n\nRegular physical activity is a powerful energizer. While it consumes energy in the short term, it significantly boosts long-term vitality by:\n*   **Improving Cardiovascular Health:** Enhances oxygen and nutrient delivery to cells.\n*   **Boosting Mitochondrial Function:** Exercise stimulates the growth of new mitochondria and improves the efficiency of existing ones, leading to more ATP production.\n*   **Releasing Endorphins:** These natural mood elevators can reduce perceptions of fatigue and enhance overall well-being.\n*   **Enhancing Sleep Quality:** Moderate exercise can promote deeper, more restorative sleep.\n\n#### Rest and Recovery\n\nAdequate sleep is non-negotiable for energy restoration. During sleep, the body repairs tissues, consolidates memories, and rebalances hormones.\n*   **Sleep Quantity and Quality:** Aim for consistent sleep schedules, create a conducive sleep environment, and address any underlying sleep disorders.\n*   **Stress Management:** Chronic stress elevates cortisol levels, which can disrupt sleep, impair immune function, and lead to adrenal fatigue. Techniques like mindfulness, meditation, deep breathing, and spending time in nature can mitigate stress's impact.\n*   **Scheduled Breaks:** Incorporating short breaks throughout the day, whether for stretching, a brief walk, or a moment of quiet reflection, can prevent mental fatigue and maintain focus.\n\n#### Mental and Emotional Well-being\n\nOur mental and emotional states profoundly influence our physical energy.\n*   **Cognitive Load:** Overthinking, constant worry, and multitasking can deplete mental energy rapidly. Prioritizing tasks, setting boundaries, and practicing single-tasking can conserve cognitive resources.\n*   **Emotional Resilience:** Managing emotions effectively prevents energy drains from anger, frustration, or sadness. Cultivating positive relationships and engaging in fulfilling activities can be powerful energy boosters.\n*   **Purpose and Meaning:** Having a sense of purpose can provide intrinsic motivation and a deep wellspring of energy, making challenges feel less daunting.\n\n#### Environmental Factors\n\nOur surroundings also play a role in our energy levels.\n*   **Light Exposure:** Natural light, especially in the morning, helps regulate our circadian rhythm, signaling to the body when to be alert and when to prepare for rest.\n*   **Air Quality:** Poor indoor or outdoor air quality can affect respiratory function and overall health, contributing to fatigue.\n*   **Clutter and Organization:** A chaotic environment can contribute to mental stress and reduce focus, indirectly impacting energy.\n\n### Assessing Your Energy Landscape\n\nTo effectively cultivate energysage, it's crucial to understand your personal energy patterns.\n*   **Energy Audits:** Keep a journal to track your energy levels throughout the day, noting what activities, foods, or interactions boost or drain your energy.\n*   **Identify Peak Times:** Understand when you are most productive and alert, and schedule demanding tasks accordingly.\n*   **Recognize Warning Signs:** Learn to identify early signs of fatigue, burnout, or stress before they become debilitating.\n\n### Strategies for Cultivating Energysage\n\nPractical application is key to transforming knowledge into sustained vitality.\n*   **Balanced Meals:** Prioritize whole, unprocessed foods.\n*   **Consistent Movement:** Find an activity you enjoy and make it a regular part of your routine.\n*   **Prioritize Sleep:** Establish a relaxing bedtime ritual and stick to a regular sleep schedule.\n*   **Mindful Breaks:** Integrate short periods of rest and mental disengagement throughout your day.\n*   **Practice Gratitude:** Shift your focus to positive aspects of your life to boost emotional energy.\n*   **Set Boundaries:** Learn to say \"no\" to commitments that overextend you and protect your energy reserves.\n\n### Common Obstacles to Optimal Energy\n\nSeveral factors can impede our pursuit of energysage:\n*   **Chronic Stress:** As mentioned, prolonged stress is a major energy drain.\n*   **Sedentary Lifestyle:** Lack of movement weakens the body's energy-producing systems.\n*   **Poor Diet:** Reliance on processed foods, excessive sugar, and caffeine can lead to energy crashes.\n*   **Sleep Deprivation:** Insufficient or poor-quality sleep is perhaps the most direct route to fatigue.\n*   **Nutrient Deficiencies:** Lack of essential vitamins and minerals can impair metabolic processes.\n*   **Emotional Burdens:** Unresolved emotional issues or negative relationships can be significant energy sinks.\n\n### The Synergy of Systems\n\nUltimately, energysage emphasizes the interconnectedness of all these elements. Our physical health influences our mental clarity, our emotional state impacts our sleep, and our diet fuels everything. Optimizing one area often creates positive ripple effects across others, demonstrating that true energy mastery comes from a holistic and integrated approach.\n\n## Putting This Into Practice\n\nApplying the principles of energysage in daily life requires consistency, patience, and a willingness to adapt. Start by identifying one or two areas where you feel you can make the most immediate impact, whether it's improving sleep hygiene, incorporating more whole foods, or dedicating time to stress reduction. Small, consistent changes often lead to the most sustainable results. Observe how your body and mind respond to these adjustments, using your own experience as the ultimate guide. Remember that energysage is not about rigid perfection, but about mindful self-care and continuous optimization. By becoming an active participant in managing your energy, you empower yourself to live with greater vitality and purpose, transforming the way you experience each day.\n\n## Conclusion\n\nThe journey toward mastering energysage is a profoundly rewarding one, offering a comprehensive blueprint for sustained vitality and well-being. It underscores that true energy is not merely the absence of fatigue but a dynamic state cultivated through deliberate choices across nutrition, physical activity, rest, and mental-emotional health. By understanding the intricate scientific underpinnings of energy production and embracing a holistic approach to self-care, individuals can unlock their inherent capacity for a consistently energized life. This continuous process of learning, adapting, and optimizing allows us to harness our full potential, fostering resilience and enhancing our ability to thrive in all endeavors. If you're looking for additional support, consider exploring options like [Click here](https://9ee995-6t9mw5sbjqhwdzk9m3q.hop.clickbank.net) to learn about Mitolyn. Embracing energysage means investing in your most valuable resource: your personal energy.",
  "format": "Deep Dive",
  "word_count": 1815,
  "products_mentioned": [
    "Java Burn",
    "Mitolyn"
  ],
  "generated_at": "2025-10-16T01:02:50.833156"
}